{
  "schema_version": "1",
  "artifact_version": "0.2.0",
  "profile_name": "local-rollout-verify",
  "verification_status": "passed",
  "verified_at_unix_ms": 1735689600000,
  "evidence": "local rollout verify",
  "evidence_sources": [
    {
      "artifact_path": "artifacts/eval/mnist_eval_summary.json",
      "event_name": "eval_done",
      "observed_at_unix_ms": 1735689601000
    },
    {
      "artifact_path": "artifacts/deploy/candidate_upload_request.json",
      "event_name": "artifact_upload_request_written",
      "observed_at_unix_ms": 1735689602000
    }
  ]
}
